{
  "$schema": "../schemas/auth-route.schema.json",
  "schemaVersion": "1.0",
  "routeId": "auth.route.email-verification.enter",
  "name": "Email Verification Entry",
  "path": "/auth/email-verification/enter",
  "routeType": "view",
  "viewId": "auth.email-verification.enter",
  "parameters": [],
  "status": "proposed",
  "platforms": {"web": {"status": "planned"}, "mobile": {"status": "planned"}}
}
