{
  "$schema": "../schemas/auth-route.schema.json",
  "schemaVersion": "1.0",
  "routeId": "auth.route.continue.email.password",
  "name": "Sign In with Password",
  "path": "/auth/continue/email/password",
  "routeType": "view",
  "viewId": "auth.continue.email.password",
  "parameters": [],
  "status": "active",
  "platforms": {
    "web": { "status": "implemented", "implementation": "EmailLoginPasswordComponent" },
    "mobile": { "status": "implemented", "implementation": "app/auth/continue/email/password.tsx" }
  },
  "source": { "commonLinksMember": "AuthContinueEmailPassword", "angularComponent": "EmailLoginPasswordComponent", "mobileRoute": "/auth/continue/email/password" },
  "notes": ["CommonLinks member must be added during route projection reconciliation."]
}
