{
  "$schema": "../schemas/auth-route.schema.json",
  "schemaVersion": "1.0",
  "routeId": "auth.route.mfa.totp.disabled",
  "name": "TOTP Disabled",
  "description": "Navigates to the successful TOTP maintenance completion surface after TOTP is turned off.",
  "path": "/auth/mfa/totp/disabled",
  "routeType": "view",
  "viewId": "auth.mfa.totp.disabled",
  "parameters": [],
  "status": "active",
  "platforms": {
    "web": { "status": "planned" },
    "mobile": { "status": "planned" }
  }
}
