{
  "$schema": "../schemas/auth-route.schema.json",
  "schemaVersion": "1.0",
  "routeId": "auth.route.password.change.complete",
  "name": "Password Changed",
  "description": "Displays the completion surface after a successful authenticated password change.",
  "path": "/auth/password/change/complete",
  "routeType": "view",
  "viewId": "auth.password.change.complete",
  "parameters": [],
  "status": "proposed",
  "platforms": {
    "web": {
      "status": "planned",
      "notes": "Canonical route reserved for the planned password-change completion surface."
    },
    "mobile": {
      "status": "planned",
      "notes": "Canonical route reserved for the planned password-change completion surface."
    }
  }
}