{
  "$schema": "../schemas/auth-route.schema.json",
  "schemaVersion": "1.0",
  "routeId": "auth.route.continue.totp.unable",
  "name": "TOTP Could Not Authenticate",
  "description": "Dedicated rejected TOTP sign-in outcome surface with Try Again and Start Over recovery actions.",
  "path": "/auth/continue/totp/unable",
  "routeType": "view",
  "viewId": "auth.continue.totp.unable",
  "parameters": [],
  "status": "active",
  "commonLinks": {
    "status": "implemented",
    "repository": "LagoVista/UserAdmin",
    "path": "src/LagoVista.UserAdmin/CommonLinks.cs",
    "member": "AuthContinueTotpUnable",
    "value": "/auth/continue/totp/unable"
  },
  "platforms": {
    "web": { "status": "implemented", "repository": "softwarelogistics/nuviot-ui-shared", "route": "/auth/continue/totp/unable" },
    "mobile": { "status": "implemented", "repository": "nuviot/vtm-client", "route": "/auth/continue/totp/unable" }
  },
  "source": {
    "commonLinksMember": "AuthContinueTotpUnable"
  }
}
