{
  "$schema": "../schemas/auth-route.schema.json",
  "schemaVersion": "1.0",
  "routeId": "auth.route.passkey.enrollment.start",
  "name": "Start Passkey Enrollment",
  "path": "/auth/passkey/enrollment/start",
  "routeType": "view",
  "viewId": "auth.passkey.enrollment.start",
  "status": "active",
  "platforms": {
    "web": { "status": "implemented" },
    "mobile": { "status": "planned" }
  },
  "source": { "commonLinksMember": "PasskeyEnrollmentStart" },
  "notes": ["Replaces /auth/passkey/enroll/start."]
}